{
  "$schema": "https://github.com/btwld/wayfinder/blob/main/docs/schemas/wayfinder-rules.schema.json",
  "format": 1,
  "namespace": "concepta-profile",
  "profile": {
    "id": "bitwild_profile",
    "release": "2026.2"
  },
  "$defs": {
    "text": {
      "type": "string",
      "pattern": "\\S"
    },
    "frontmatter-key": {
      "x-slot": "okf.frontmatterKeys"
    },
    "type-name": {
      "x-slot": "profile.types"
    },
    "actor-id": {
      "x-slot": "profile.actors"
    }
  },
  "rules": [
    {
      "id": "okf-release-binding",
      "category": "structure",
      "severity": "error",
      "status": "stable",
      "ref": "§11",
      "description": "The `profile.md` declaration and the root index MUST both declare `okf_version` `\"0.2\"`.",
      "message": "The declaration, root index, and Profile release must all bind to OKF 0.2.",
      "check": {
        "builtin": "declared-okf-binding"
      }
    },
    {
      "id": "profile-declaration-kind",
      "category": "structure",
      "severity": "error",
      "status": "stable",
      "ref": "§11",
      "description": "The root `profile.md` MUST be an ordinary concept of `type: Knowledge Profile`.",
      "message": "profile.md must have type Knowledge Profile.",
      "check": {
        "subject": "concept",
        "schema": {
          "if": {
            "properties": {
              "path": {
                "const": "profile.md"
              }
            }
          },
          "then": {
            "properties": {
              "type": {
                "const": "Knowledge Profile"
              }
            }
          }
        }
      },
      "tests": {
        "valid": [
          {
            "path": "profile.md",
            "type": "Knowledge Profile"
          },
          {
            "path": "area/note.md",
            "type": "Guide"
          }
        ],
        "invalid": [
          {
            "path": "profile.md",
            "type": "Guide"
          },
          {
            "path": "profile.md",
            "type": null
          }
        ]
      }
    },
    {
      "id": "concept-baseline-fields",
      "category": "vocabulary",
      "severity": "error",
      "status": "stable",
      "ref": "§5.1",
      "description": "A concept MUST carry nonempty `type`, `title`, `description`, and `status` fields.",
      "message": "Every concept must contain non-empty string values for type, title, description, and status.",
      "check": {
        "subject": "frontmatter",
        "schema": {
          "required": [
            "type",
            "title",
            "description",
            "status"
          ],
          "properties": {
            "type": {
              "$ref": "#/$defs/text"
            },
            "title": {
              "$ref": "#/$defs/text"
            },
            "description": {
              "$ref": "#/$defs/text"
            },
            "status": {
              "$ref": "#/$defs/text"
            }
          }
        }
      },
      "tests": {
        "valid": [
          {
            "type": "Guide",
            "title": "Title",
            "description": "Summary.",
            "status": "stable"
          }
        ],
        "invalid": [
          {
            "type": "Guide",
            "title": "Title",
            "description": "Summary."
          },
          {
            "type": " ",
            "title": "Title",
            "description": "Summary.",
            "status": "stable"
          },
          {
            "type": 1,
            "title": "Title",
            "description": "Summary.",
            "status": "stable"
          }
        ]
      }
    },
    {
      "id": "frontmatter-fields-okf",
      "category": "vocabulary",
      "severity": "error",
      "status": "stable",
      "ref": "§5.1",
      "description": "Concepta producers MUST NOT introduce namespaced or otherwise producer-defined frontmatter fields.",
      "message": "Concepta producers may use only OKF 0.2 frontmatter fields; found {failing}.",
      "check": {
        "subject": "concept",
        "each": "keys",
        "schema": {
          "properties": {
            "value": {
              "$ref": "#/$defs/frontmatter-key"
            }
          }
        }
      },
      "tests": {
        "valid": [
          {
            "value": "type"
          },
          {
            "value": "sources"
          }
        ],
        "invalid": [
          {
            "value": "confidence"
          }
        ]
      }
    },
    {
      "id": "status-value",
      "category": "vocabulary",
      "severity": "error",
      "status": "stable",
      "ref": "§5.1",
      "description": "A concept's `status` MUST be `draft`, `stable`, or `deprecated`.",
      "message": "Status must be draft, stable, or deprecated.",
      "check": {
        "subject": "frontmatter",
        "schema": {
          "if": {
            "required": [
              "status"
            ],
            "properties": {
              "status": {
                "$ref": "#/$defs/text"
              }
            }
          },
          "then": {
            "properties": {
              "status": {
                "pattern": "^\\s*(draft|stable|deprecated)\\s*$"
              }
            }
          }
        }
      },
      "tests": {
        "valid": [
          {
            "status": "draft"
          },
          {
            "status": " stable "
          },
          {
            "status": ""
          },
          {},
          {
            "status": 1
          }
        ],
        "invalid": [
          {
            "status": "final"
          },
          {
            "status": "Stable"
          }
        ]
      }
    },
    {
      "id": "tag-literal-duplication",
      "category": "vocabulary",
      "severity": "error",
      "status": "stable",
      "ref": "§5.1",
      "description": "A tag MUST NOT exactly repeat the concept's `type`, `status`, derived trust tier, or a standard relationship label.",
      "message": "Tags must not duplicate type, status, trust, or standard relationship values; found {failing}.",
      "check": {
        "builtin": "tag-literal-duplication"
      }
    },
    {
      "id": "generation-provenance-recommended",
      "category": "provenance",
      "severity": "advisory",
      "status": "stable",
      "ref": "§5.1",
      "description": "A concept carries no `generated` field recording how its current content was produced.",
      "message": "Generation provenance is recommended when it is known.",
      "check": {
        "subject": "frontmatter",
        "schema": {
          "required": [
            "generated"
          ]
        }
      },
      "tests": {
        "valid": [
          {
            "generated": {
              "by": "process:ci"
            }
          },
          {
            "generated": null
          }
        ],
        "invalid": [
          {},
          {
            "type": "Guide"
          }
        ]
      }
    },
    {
      "id": "type-registry-present",
      "category": "vocabulary",
      "severity": "error",
      "status": "stable",
      "ref": "§5.2",
      "description": "A bundle MUST contain a type registry at `types.md`.",
      "message": "The bundle must contain types.md.",
      "check": {
        "builtin": "type-registry-present"
      }
    },
    {
      "id": "type-registry-kind",
      "category": "vocabulary",
      "severity": "error",
      "status": "stable",
      "ref": "§5.2",
      "description": "The type registry at `types.md` MUST be an ordinary concept of `type: Type Registry`.",
      "message": "types.md must have type Type Registry.",
      "check": {
        "builtin": "type-registry-kind"
      }
    },
    {
      "id": "type-registry-columns",
      "category": "vocabulary",
      "severity": "error",
      "status": "stable",
      "ref": "§6.1.1",
      "description": "The type registry table MUST use exactly the columns `Type` and `Intended content`, in that order.",
      "message": "The type registry must use exactly Type and Intended content columns.",
      "check": {
        "builtin": "type-registry-columns"
      }
    },
    {
      "id": "type-registry-standards",
      "category": "vocabulary",
      "severity": "error",
      "status": "stable",
      "ref": "§5.2",
      "description": "The type registry MUST open with all fourteen standard types in canonical order and with their exact meanings.",
      "message": "The type registry must contain all fourteen canonical standard rows.",
      "check": {
        "builtin": "type-registry-standards"
      }
    },
    {
      "id": "type-registry-order",
      "category": "vocabulary",
      "severity": "error",
      "status": "stable",
      "ref": "§5.2",
      "description": "Project-specific type rows MUST follow all standard rows in case-sensitive lexical order.",
      "message": "Project type rows must follow the standards in lexical order.",
      "check": {
        "builtin": "type-registry-order"
      }
    },
    {
      "id": "used-type-registered",
      "category": "vocabulary",
      "severity": "error",
      "status": "stable",
      "ref": "§5.2",
      "description": "Every used type MUST resolve in the type registry at `types.md`.",
      "message": "Used type {type} must be registered in types.md.",
      "check": {
        "subject": "concept",
        "schema": {
          "properties": {
            "type": {
              "anyOf": [
                {
                  "type": "null"
                },
                {
                  "$ref": "#/$defs/type-name"
                }
              ]
            }
          }
        }
      },
      "tests": {
        "slots": {
          "profile.types": [
            "Decision"
          ]
        },
        "valid": [
          {
            "path": "a.md",
            "type": "Decision"
          },